{
    "id": 4367,
    "name": "Gorad",
    "incomplete": false,
    "members": true,
    "release_date": "2003-05-07",
    "combat_level": 68,
    "size": 2,
    "hitpoints": 68,
    "max_hit": 7,
    "attack_type": "Melee",
    "attack_speed": 4,
    "aggressive": false,
    "poisonous": false,
    "immune_poison": false,
    "immune_venom": false,
    "weakness": [
        "Magic"
    ],
    "slayer_monster": true,
    "slayer_level": 1,
    "slayer_xp": 80,
    "slayer_masters": [
        "vannaka"
    ],
    "examine": "Big, dumb and ugly.",
    "wiki_name": "Gorad",
    "wiki_url": "https://oldschool.runescape.wiki/w/Gorad",
    "attack_level": 54,
    "strength_level": 54,
    "defence_level": 54,
    "magic_level": 1,
    "ranged_level": 1,
    "attack_stab": 0,
    "attack_slash": 0,
    "attack_crush": 0,
    "attack_magic": 0,
    "attack_ranged": 0,
    "defence_stab": 15,
    "defence_slash": 27,
    "defence_crush": 21,
    "defence_magic": 0,
    "defence_ranged": 0,
    "attack_accuracy": 8,
    "melee_strength": 8,
    "ranged_strength": 0,
    "magic_damage": 0,
    "drops": [],
    "rare_drop_table": false
}